{
  "schemaVersion": 2,
  "id": "2026-07-23-obra-superpowers",
  "sourceUrl": "https://github.com/obra/superpowers",
  "queryUrls": [
    "https://github.com/obra/superpowers"
  ],
  "observedAt": "2026-07-23T09:08:12Z",
  "inspectedRef": "refs/heads/main",
  "inspectedCommit": "d884ae04edebef577e82ff7c4e143debd0bbec99",
  "collectionMethod": "git-tree-and-marketplace-v1",
  "toolVersion": "0.1.0",
  "entries": [
    {
      "kind": "marketplace-entry",
      "address": ".claude-plugin/marketplace.json#/plugins/0",
      "sourceUrl": null
    },
    {
      "kind": "plugin-manifest",
      "address": ".claude-plugin/plugin.json",
      "sourceUrl": null
    },
    {
      "kind": "repository-record",
      "address": ".",
      "sourceUrl": "https://github.com/obra/superpowers"
    },
    {
      "kind": "skill-file",
      "address": "skills/brainstorming/SKILL.md",
      "sourceUrl": null
    },
    {
      "kind": "skill-file",
      "address": "skills/dispatching-parallel-agents/SKILL.md",
      "sourceUrl": null
    },
    {
      "kind": "skill-file",
      "address": "skills/executing-plans/SKILL.md",
      "sourceUrl": null
    },
    {
      "kind": "skill-file",
      "address": "skills/finishing-a-development-branch/SKILL.md",
      "sourceUrl": null
    },
    {
      "kind": "skill-file",
      "address": "skills/receiving-code-review/SKILL.md",
      "sourceUrl": null
    },
    {
      "kind": "skill-file",
      "address": "skills/requesting-code-review/SKILL.md",
      "sourceUrl": null
    },
    {
      "kind": "skill-file",
      "address": "skills/subagent-driven-development/SKILL.md",
      "sourceUrl": null
    },
    {
      "kind": "skill-file",
      "address": "skills/systematic-debugging/SKILL.md",
      "sourceUrl": null
    },
    {
      "kind": "skill-file",
      "address": "skills/test-driven-development/SKILL.md",
      "sourceUrl": null
    },
    {
      "kind": "skill-file",
      "address": "skills/using-git-worktrees/SKILL.md",
      "sourceUrl": null
    },
    {
      "kind": "skill-file",
      "address": "skills/using-superpowers/SKILL.md",
      "sourceUrl": null
    },
    {
      "kind": "skill-file",
      "address": "skills/verification-before-completion/SKILL.md",
      "sourceUrl": null
    },
    {
      "kind": "skill-file",
      "address": "skills/writing-plans/SKILL.md",
      "sourceUrl": null
    },
    {
      "kind": "skill-file",
      "address": "skills/writing-skills/SKILL.md",
      "sourceUrl": null
    }
  ],
  "countMetrics": [
    {
      "kind": "marketplace-entry",
      "reportedCount": null,
      "reportedCountSourceUrl": null,
      "independentlyCountedTotal": 1
    },
    {
      "kind": "plugin-manifest",
      "reportedCount": null,
      "reportedCountSourceUrl": null,
      "independentlyCountedTotal": 1
    },
    {
      "kind": "repository-record",
      "reportedCount": null,
      "reportedCountSourceUrl": null,
      "independentlyCountedTotal": 1
    },
    {
      "kind": "skill-file",
      "reportedCount": null,
      "reportedCountSourceUrl": null,
      "independentlyCountedTotal": 14
    }
  ],
  "contentSha256": "9ed7828bf274052df1deca567333221cb045f8269dbf5cb382cc8567f7c89342"
}
