{
  "schemaVersion": 2,
  "id": "2026-07-23-huggingface-skills",
  "sourceUrl": "https://github.com/huggingface/skills",
  "queryUrls": [
    "https://github.com/huggingface/skills"
  ],
  "observedAt": "2026-07-23T09:08:12Z",
  "inspectedRef": "refs/heads/main",
  "inspectedCommit": "86cdeee824b73e504198b6005bb113552cdfa7ba",
  "collectionMethod": "git-tree-and-marketplace-v1",
  "toolVersion": "0.1.0",
  "entries": [
    {
      "kind": "marketplace-entry",
      "address": ".claude-plugin/marketplace.json#/plugins/0",
      "sourceUrl": null
    },
    {
      "kind": "plugin-manifest",
      "address": ".claude-plugin/plugin.json",
      "sourceUrl": null
    },
    {
      "kind": "repository-record",
      "address": ".",
      "sourceUrl": "https://github.com/huggingface/skills"
    },
    {
      "kind": "skill-file",
      "address": "hf-mcp/skills/hf-mcp/SKILL.md",
      "sourceUrl": null
    },
    {
      "kind": "skill-file",
      "address": "skills/hf-cli/SKILL.md",
      "sourceUrl": null
    },
    {
      "kind": "skill-file",
      "address": "skills/hf-cloud-aws-context-discovery/SKILL.md",
      "sourceUrl": null
    },
    {
      "kind": "skill-file",
      "address": "skills/hf-cloud-python-env-setup/SKILL.md",
      "sourceUrl": null
    },
    {
      "kind": "skill-file",
      "address": "skills/hf-cloud-sagemaker-deployment-planner/SKILL.md",
      "sourceUrl": null
    },
    {
      "kind": "skill-file",
      "address": "skills/hf-cloud-sagemaker-iam-preflight/SKILL.md",
      "sourceUrl": null
    },
    {
      "kind": "skill-file",
      "address": "skills/hf-cloud-sagemaker-production-defaults/SKILL.md",
      "sourceUrl": null
    },
    {
      "kind": "skill-file",
      "address": "skills/hf-cloud-serving-image-selection/SKILL.md",
      "sourceUrl": null
    },
    {
      "kind": "skill-file",
      "address": "skills/hf-mem/SKILL.md",
      "sourceUrl": null
    },
    {
      "kind": "skill-file",
      "address": "skills/huggingface-best/SKILL.md",
      "sourceUrl": null
    },
    {
      "kind": "skill-file",
      "address": "skills/huggingface-community-evals/SKILL.md",
      "sourceUrl": null
    },
    {
      "kind": "skill-file",
      "address": "skills/huggingface-datasets/SKILL.md",
      "sourceUrl": null
    },
    {
      "kind": "skill-file",
      "address": "skills/huggingface-gradio/SKILL.md",
      "sourceUrl": null
    },
    {
      "kind": "skill-file",
      "address": "skills/huggingface-llm-trainer/SKILL.md",
      "sourceUrl": null
    },
    {
      "kind": "skill-file",
      "address": "skills/huggingface-local-models/SKILL.md",
      "sourceUrl": null
    },
    {
      "kind": "skill-file",
      "address": "skills/huggingface-lora-space-builder/SKILL.md",
      "sourceUrl": null
    },
    {
      "kind": "skill-file",
      "address": "skills/huggingface-paper-publisher/SKILL.md",
      "sourceUrl": null
    },
    {
      "kind": "skill-file",
      "address": "skills/huggingface-papers/SKILL.md",
      "sourceUrl": null
    },
    {
      "kind": "skill-file",
      "address": "skills/huggingface-spaces/SKILL.md",
      "sourceUrl": null
    },
    {
      "kind": "skill-file",
      "address": "skills/huggingface-tool-builder/SKILL.md",
      "sourceUrl": null
    },
    {
      "kind": "skill-file",
      "address": "skills/huggingface-trackio/SKILL.md",
      "sourceUrl": null
    },
    {
      "kind": "skill-file",
      "address": "skills/huggingface-vision-trainer/SKILL.md",
      "sourceUrl": null
    },
    {
      "kind": "skill-file",
      "address": "skills/huggingface-zerogpu/SKILL.md",
      "sourceUrl": null
    },
    {
      "kind": "skill-file",
      "address": "skills/train-sentence-transformers/SKILL.md",
      "sourceUrl": null
    },
    {
      "kind": "skill-file",
      "address": "skills/transformers-js/SKILL.md",
      "sourceUrl": null
    },
    {
      "kind": "skill-file",
      "address": "skills/trl-training/SKILL.md",
      "sourceUrl": null
    }
  ],
  "countMetrics": [
    {
      "kind": "marketplace-entry",
      "reportedCount": null,
      "reportedCountSourceUrl": null,
      "independentlyCountedTotal": 1
    },
    {
      "kind": "plugin-manifest",
      "reportedCount": null,
      "reportedCountSourceUrl": null,
      "independentlyCountedTotal": 1
    },
    {
      "kind": "repository-record",
      "reportedCount": null,
      "reportedCountSourceUrl": null,
      "independentlyCountedTotal": 1
    },
    {
      "kind": "skill-file",
      "reportedCount": null,
      "reportedCountSourceUrl": null,
      "independentlyCountedTotal": 26
    }
  ],
  "contentSha256": "c99599d96773e9d76146068d2b63af1a053da7d7da8840b60f332948026e982f"
}
