{
  "schemaVersion": 2,
  "id": "2026-07-23-coreyhaines31-marketingskills",
  "sourceUrl": "https://github.com/coreyhaines31/marketingskills",
  "queryUrls": [
    "https://github.com/coreyhaines31/marketingskills"
  ],
  "observedAt": "2026-07-23T09:08:12Z",
  "inspectedRef": "refs/heads/main",
  "inspectedCommit": "c21a984a56da10fb6085e6334f6f60929220a4da",
  "collectionMethod": "git-tree-and-marketplace-v1",
  "toolVersion": "0.1.0",
  "entries": [
    {
      "kind": "marketplace-entry",
      "address": ".claude-plugin/marketplace.json#/plugins/0",
      "sourceUrl": null
    },
    {
      "kind": "plugin-manifest",
      "address": ".claude-plugin/plugin.json",
      "sourceUrl": null
    },
    {
      "kind": "repository-record",
      "address": ".",
      "sourceUrl": "https://github.com/coreyhaines31/marketingskills"
    },
    {
      "kind": "skill-file",
      "address": "skills/ab-testing/SKILL.md",
      "sourceUrl": null
    },
    {
      "kind": "skill-file",
      "address": "skills/ad-creative/SKILL.md",
      "sourceUrl": null
    },
    {
      "kind": "skill-file",
      "address": "skills/ads/SKILL.md",
      "sourceUrl": null
    },
    {
      "kind": "skill-file",
      "address": "skills/ai-seo/SKILL.md",
      "sourceUrl": null
    },
    {
      "kind": "skill-file",
      "address": "skills/analytics/SKILL.md",
      "sourceUrl": null
    },
    {
      "kind": "skill-file",
      "address": "skills/aso/SKILL.md",
      "sourceUrl": null
    },
    {
      "kind": "skill-file",
      "address": "skills/churn-prevention/SKILL.md",
      "sourceUrl": null
    },
    {
      "kind": "skill-file",
      "address": "skills/co-marketing/SKILL.md",
      "sourceUrl": null
    },
    {
      "kind": "skill-file",
      "address": "skills/cold-email/SKILL.md",
      "sourceUrl": null
    },
    {
      "kind": "skill-file",
      "address": "skills/community-marketing/SKILL.md",
      "sourceUrl": null
    },
    {
      "kind": "skill-file",
      "address": "skills/competitor-profiling/SKILL.md",
      "sourceUrl": null
    },
    {
      "kind": "skill-file",
      "address": "skills/competitors/SKILL.md",
      "sourceUrl": null
    },
    {
      "kind": "skill-file",
      "address": "skills/content-strategy/SKILL.md",
      "sourceUrl": null
    },
    {
      "kind": "skill-file",
      "address": "skills/copy-editing/SKILL.md",
      "sourceUrl": null
    },
    {
      "kind": "skill-file",
      "address": "skills/copywriting/SKILL.md",
      "sourceUrl": null
    },
    {
      "kind": "skill-file",
      "address": "skills/cro/SKILL.md",
      "sourceUrl": null
    },
    {
      "kind": "skill-file",
      "address": "skills/customer-research/SKILL.md",
      "sourceUrl": null
    },
    {
      "kind": "skill-file",
      "address": "skills/directory-submissions/SKILL.md",
      "sourceUrl": null
    },
    {
      "kind": "skill-file",
      "address": "skills/emails/SKILL.md",
      "sourceUrl": null
    },
    {
      "kind": "skill-file",
      "address": "skills/free-tools/SKILL.md",
      "sourceUrl": null
    },
    {
      "kind": "skill-file",
      "address": "skills/image/SKILL.md",
      "sourceUrl": null
    },
    {
      "kind": "skill-file",
      "address": "skills/influencer-marketing/SKILL.md",
      "sourceUrl": null
    },
    {
      "kind": "skill-file",
      "address": "skills/launch/SKILL.md",
      "sourceUrl": null
    },
    {
      "kind": "skill-file",
      "address": "skills/lead-magnets/SKILL.md",
      "sourceUrl": null
    },
    {
      "kind": "skill-file",
      "address": "skills/marketing-council/SKILL.md",
      "sourceUrl": null
    },
    {
      "kind": "skill-file",
      "address": "skills/marketing-ideas/SKILL.md",
      "sourceUrl": null
    },
    {
      "kind": "skill-file",
      "address": "skills/marketing-loops/SKILL.md",
      "sourceUrl": null
    },
    {
      "kind": "skill-file",
      "address": "skills/marketing-plan/SKILL.md",
      "sourceUrl": null
    },
    {
      "kind": "skill-file",
      "address": "skills/marketing-psychology/SKILL.md",
      "sourceUrl": null
    },
    {
      "kind": "skill-file",
      "address": "skills/offers/SKILL.md",
      "sourceUrl": null
    },
    {
      "kind": "skill-file",
      "address": "skills/onboarding/SKILL.md",
      "sourceUrl": null
    },
    {
      "kind": "skill-file",
      "address": "skills/paywalls/SKILL.md",
      "sourceUrl": null
    },
    {
      "kind": "skill-file",
      "address": "skills/popups/SKILL.md",
      "sourceUrl": null
    },
    {
      "kind": "skill-file",
      "address": "skills/pricing/SKILL.md",
      "sourceUrl": null
    },
    {
      "kind": "skill-file",
      "address": "skills/product-marketing/SKILL.md",
      "sourceUrl": null
    },
    {
      "kind": "skill-file",
      "address": "skills/programmatic-seo/SKILL.md",
      "sourceUrl": null
    },
    {
      "kind": "skill-file",
      "address": "skills/prospecting/SKILL.md",
      "sourceUrl": null
    },
    {
      "kind": "skill-file",
      "address": "skills/public-relations/SKILL.md",
      "sourceUrl": null
    },
    {
      "kind": "skill-file",
      "address": "skills/referrals/SKILL.md",
      "sourceUrl": null
    },
    {
      "kind": "skill-file",
      "address": "skills/revops/SKILL.md",
      "sourceUrl": null
    },
    {
      "kind": "skill-file",
      "address": "skills/sales-enablement/SKILL.md",
      "sourceUrl": null
    },
    {
      "kind": "skill-file",
      "address": "skills/schema/SKILL.md",
      "sourceUrl": null
    },
    {
      "kind": "skill-file",
      "address": "skills/seo-audit/SKILL.md",
      "sourceUrl": null
    },
    {
      "kind": "skill-file",
      "address": "skills/signup/SKILL.md",
      "sourceUrl": null
    },
    {
      "kind": "skill-file",
      "address": "skills/site-architecture/SKILL.md",
      "sourceUrl": null
    },
    {
      "kind": "skill-file",
      "address": "skills/sms/SKILL.md",
      "sourceUrl": null
    },
    {
      "kind": "skill-file",
      "address": "skills/social/SKILL.md",
      "sourceUrl": null
    },
    {
      "kind": "skill-file",
      "address": "skills/video/SKILL.md",
      "sourceUrl": null
    }
  ],
  "countMetrics": [
    {
      "kind": "marketplace-entry",
      "reportedCount": null,
      "reportedCountSourceUrl": null,
      "independentlyCountedTotal": 1
    },
    {
      "kind": "plugin-manifest",
      "reportedCount": null,
      "reportedCountSourceUrl": null,
      "independentlyCountedTotal": 1
    },
    {
      "kind": "repository-record",
      "reportedCount": null,
      "reportedCountSourceUrl": null,
      "independentlyCountedTotal": 1
    },
    {
      "kind": "skill-file",
      "reportedCount": null,
      "reportedCountSourceUrl": null,
      "independentlyCountedTotal": 48
    }
  ],
  "contentSha256": "2652f28194c95f3961b4d0326787daaa8a48b3efddb9886128654c7cc343bd59"
}
